College,Website,Courses
Government Degree College Jammu,https://www.gdcjammu.in,"B.A English, B.A History, B.Sc Physics, B.Sc Mathematics, B.Com Accounting"
Government Degree College for Women, Gandhinagar,https://www.gdcfwgandhinagar.in,"B.A Economics, B.A Political Science, B.Sc Chemistry, B.Com General, BBA"
Government Medical College Jammu,https://www.gmcjammu.in,"MBBS, B.Sc Nursing, MD/MS (Postgraduate)"
Sri Pratap College Srinagar,https://www.spcollege.in,"B.A Urdu, B.A Sociology, B.Sc Botany, B.Sc Zoology, B.Com"
Government Degree College Anantnag,https://www.gdcanantnag.in,"B.A Kashmiri, B.Sc Geology, B.Com Finance, Vocational IT"
Government Degree College Baramulla,https://www.gdcbaramulla.in,"B.A Philosophy, B.Sc Electronics, B.Com Taxation, B.Voc Tourism"
Government College for Women, M.A. Road Srinagar,https://www.gcwsrinagar.in,"B.A Education, B.Sc Home Science, B.Com Marketing"
Government Degree College Rajouri,https://www.gdcrj.in,"B.A Geography, B.Sc Computer Science, B.Com E-Commerce"
